{
  "entryId": "jrnl_001",
  "athleteId": "ath_001",
  "ownerUid": "uid_parent_001",
  "schemaVersion": "1.0.0",
  "entryDate": "2026-06-18T22:00:00Z",
  "timezone": "America/New_York",
  "entryType": "reflection",
  "title": "After Thursday Practice",
  "prompt": "What felt better today than last week?",
  "body": "My edges felt smoother and I was less nervous during the program run-through.",
  "mood": "focused",
  "confidence": 8,
  "energy": 6,
  "tags": ["edges", "confidence", "program"],
  "relatedTrainingRecordId": "trn_001",
  "visibility": "private",
  "status": "published",
  "externalRefs": {
    "blazeJournal": {
      "legacyEntryId": "journal-778"
    }
  },
  "extensions": {
    "blazeJournal": {
      "promptSet": "weekly-reflection"
    }
  },
  "createdAt": "2026-06-18T22:00:00Z",
  "updatedAt": "2026-06-18T22:05:00Z",
  "createdByUid": "uid_parent_001",
  "updatedByUid": "uid_parent_001",
  "sourceApp": "blazeJournal"
}
